"Job name","% of total workforce","FTEs","Automatable FTEs","Automatable %","Augmentable FTEs","Augmentable %","Unimpacted FTEs","Unimpacted %"
"Food and Tobacco Roasting, Baking, and Drying Machine Operators and Tenders","0.014","509.92","345.094","67.676","12.774","2.505","152.052","29.819"
"Electro-Mechanical and Mechatronics Technologists and Technicians","0.017","592.12","300.824","50.805","55.984","9.455","235.313","39.741"
"Shoe and Leather Workers and Repairers","0.012","447.36","349.482","78.121","3.311","0.74","94.568","21.139"
"Aircraft Service Attendants and Transportation Workers, All Other","0.015","551.98","349.319","63.285","0","0","202.661","36.715"
"Lodging Managers","0.021","743.09","149.617","20.135","193.732","26.071","399.741","53.794"
"Health Information Technologists, Medical Registrars, Surgical Assistants, and Healthcare Practitioners and Technical Workers, All Other","0.022","789.3","124.772","15.808","217.412","27.545","447.116","56.647"
"Data Scientists and Mathematical Science Occupations, All Other","0.016","577.86","292.267","50.577","45.089","7.803","240.503","41.62"
"Morticians, Undertakers, and Funeral Arrangers","0.019","682.59","43.795","6.416","285.427","41.815","353.369","51.769"
"Health Education Specialists","0.019","680.63","66.719","9.802","257.085","37.772","356.827","52.426"
"Aerospace Engineering and Operations Technologists and Technicians","0.014","514.07","173.057","33.664","149.495","29.081","191.517","37.255"
"Locksmiths and Safe Repairers","0.014","483.91","254.061","52.502","68.425","14.14","161.424","33.358"
"Mechanical Door Repairers","0.017","617.59","232.735","37.684","89.366","14.47","295.489","47.846"
"Radio, Cellular, and Tower Equipment Installers and Repairers","0.018","631.54","109.983","17.415","208.592","33.029","312.965","49.556"
"Clergy","0.025","894.85","0","0","317.916","35.527","576.934","64.473"
"History Teachers, Postsecondary","0.015","530.25","45.833","8.644","271.297","51.164","213.12","40.192"
"Septic Tank Servicers and Sewer Pipe Cleaners","0.013","455.35","174.491","38.32","138.008","30.308","142.851","31.372"
"Writers and Authors","0.019","666.31","17.441","2.618","294.249","44.161","354.62","53.222"
"Rolling Machine Setters, Operators, and Tenders, Metal and Plastic","0.012","443.81","283.949","63.98","19.709","4.441","140.152","31.579"
"Magnetic Resonance Imaging Technologists","0.019","664.86","150.616","22.654","152.658","22.961","361.586","54.385"
"Political Science Teachers, Postsecondary","0.012","432.06","23.116","5.35","279.616","64.717","129.328","29.933"
"Baggage Porters and Bellhops","0.012","438.53","125.758","28.677","175.411","40","137.362","31.323"
"Natural Sciences Managers","0.023","836.34","0","0","297.298","35.548","539.042","64.452"
"Floral Designers","0.014","503.78","89.842","17.834","205.542","40.8","208.397","41.367"
"Real Estate Brokers","0.016","581.96","92.334","15.866","201.586","34.639","288.04","49.495"
"Milling and Planing Machine Setters, Operators, and Tenders, Metal and Plastic","0.01","359.69","276.308","76.818","13.25","3.684","70.133","19.498"
"Materials Engineers","0.022","788.08","22.112","2.806","266.252","33.785","499.716","63.409"
"Radiation Therapists","0.017","607.57","197.288","32.472","76.602","12.608","333.68","54.92"
"Gambling and Sports Book Writers and Runners","0.009","333.05","271.425","81.497","1.422","0.427","60.203","18.076"
"Commercial and Industrial Designers","0.014","488.86","15.883","3.249","255.977","52.362","217","44.389"
"Furniture Finishers","0.01","360.32","151.182","41.958","117.948","32.734","91.19","25.308"
"Tour and Travel Guides","0.013","483.68","105.276","21.766","157.964","32.659","220.44","45.576"
"Anesthesiologists","0.022","774.15","45.135","5.83","213.372","27.562","515.644","66.608"
"Rail Car Repairers","0.017","599.87","231.066","38.519","23.688","3.949","345.116","57.532"
"Environmental Engineering Technologists and Technicians","0.012","414.34","190.273","45.922","61.933","14.947","162.134","39.131"
"Labor Relations Specialists","0.015","553.82","14.91","2.692","234.581","42.357","304.329","54.951"
"Cleaning, Washing, and Metal Pickling Equipment Operators and Tenders","0.01","372.39","245.324","65.878","0","0","127.066","34.122"
"Landscape Architects","0.012","423.64","0","0","239.262","56.478","184.378","43.522"
"Recreation and Fitness Studies Teachers, Postsecondary","0.011","387.85","28.844","7.437","209.127","53.92","149.879","38.644"
"Word Processors and Typists","0.007","259.12","223.713","86.336","11.52","4.446","23.887","9.219"
"Chiropractors","0.019","686.45","79.34","11.558","155.602","22.668","451.507","65.774"
"Community and Social Service Specialists, All Other","0.015","526.19","46.022","8.746","187.138","35.565","293.03","55.689"
"Training and Development Managers","0.014","504.8","0","0","233.109","46.178","271.691","53.822"
"Insurance Appraisers, Auto Damage","0.008","270.13","232.557","86.091","0","0","37.573","13.909"
"Rail-Track Laying and Maintenance Equipment Operators","0.011","383.26","179.524","46.841","52.938","13.813","150.797","39.346"
"Automotive Glass Installers and Repairers","0.015","533.4","175.872","32.972","54.46","10.21","303.069","56.818"
"Conveyor Operators and Tenders","0.009","327.88","221.588","67.582","8.366","2.552","97.926","29.866"
"Social Sciences Teachers, Postsecondary, All Other","0.01","348.59","27.111","7.777","200.505","57.519","120.975","34.704"
"Special Effects Artists and Animators","0.013","471.09","0","0","226.263","48.03","244.827","51.97"
"Sailors and Marine Oilers","0.011","408.25","186.828","45.763","36.675","8.984","184.747","45.253"
"Drilling and Boring Machine Tool Setters, Operators, and Tenders, Metal and Plastic","0.008","289.64","190.614","65.811","32.845","11.34","66.181","22.849"
"Community Health Workers","0.014","499.66","43.567","8.719","177.437","35.512","278.656","55.769"
"Broadcast Technicians","0.009","317.18","156.499","49.341","64.101","20.21","96.579","30.449"
"Social Science Research Assistants","0.012","424.54","134.018","31.568","86.386","20.348","204.136","48.084"
"Foreign Language and Literature Teachers, Postsecondary","0.01","348.59","39.046","11.201","179.27","51.427","130.274","37.372"
"Agricultural and Food Science Technicians","0.012","413.05","109.181","26.433","107.125","25.935","196.744","47.632"
"Legal Support Workers, All Other","0.009","327.16","171.699","52.482","43.003","13.144","112.458","34.374"
"Pediatricians, General","0.019","674.95","0","0","214.444","31.772","460.506","68.228"
"Motorboat Mechanics and Service Technicians","0.012","423.07","156.823","37.068","55.976","13.231","210.271","49.701"
"Cartographers and Photogrammetrists","0.009","325","89.225","27.454","118.8","36.554","116.975","35.992"
"Crematory Operators and Personal Care and Service Workers, All Other","0.015","552.27","94.462","17.104","112.433","20.358","345.375","62.537"
"Philosophy and Religion Teachers, Postsecondary","0.009","324.04","29.362","9.061","177.477","54.77","117.201","36.169"
"Etchers and Engravers","0.007","263.79","192.344","72.916","11.859","4.496","59.587","22.589"
"Financial Clerks, All Other","0.006","224.29","200.686","89.476","2.038","0.909","21.566","9.615"
"Chemistry Teachers, Postsecondary","0.009","333.86","23.175","6.941","178.573","53.487","132.112","39.571"
"Helpers--Roofers","0.01","359.28","94.08","26.186","106.829","29.734","158.371","44.08"
"Advertising and Promotions Managers","0.01","368.46","0","0","198.983","54.004","169.477","45.996"
"Biochemists and Biophysicists","0.014","497.8","22.572","4.534","176.248","35.405","298.979","60.06"
"Recreational Vehicle Service Technicians","0.01","346.08","112.674","32.557","85.696","24.762","147.71","42.681"
"Electrical and Electronics Repairers, Powerhouse, Substation, and Relay","0.014","506.47","111.95","22.104","84.383","16.661","310.137","61.235"
"Rehabilitation Counselors","0.012","420.86","40.813","9.697","154.389","36.684","225.659","53.618"
"Material Moving Workers, All Other","0.007","267.85","151.746","56.653","42.747","15.959","73.357","27.387"
"Athletic Trainers","0.015","529.01","30.533","5.772","163.397","30.887","335.08","63.341"
"Criminal Justice and Law Enforcement Teachers, Postsecondary","0.008","282.29","28.229","10","159.447","56.483","94.614","33.517"
"Eligibility Interviewers, Government Programs","0.008","282.95","171.674","60.673","15.895","5.617","95.381","33.71"
"Career/Technical Education Teachers, Middle School","0.011","380.5","21.571","5.669","165.72","43.553","193.209","50.778"
"Coil Winders, Tapers, and Finishers","0.007","235.46","185.898","78.951","0","0","49.562","21.049"
"Public Safety Telecommunicators","0.008","270.51","151.905","56.155","29.956","11.074","88.649","32.771"
"Law Teachers, Postsecondary","0.007","245.48","17.165","6.993","153.62","62.58","74.694","30.428"
"Power Distributors and Dispatchers","0.01","348.63","159.587","45.775","9.103","2.611","179.94","51.614"
"Avionics Technicians","0.01","363.77","44.677","12.282","122.746","33.743","196.347","53.976"
"Tapers","0.006","227.29","134.624","59.23","30.228","13.299","62.437","27.47"
"Obstetricians and Gynecologists","0.013","452.76","35.284","7.793","125.592","27.739","291.885","64.468"
"Physics Teachers, Postsecondary","0.007","257.77","16.744","6.496","143.965","55.85","97.061","37.654"
"Home Appliance Repairers","0.009","325.75","99.794","30.635","59.423","18.242","166.533","51.123"
"Education Administrators, All Other","0.009","319.25","3.033","0.95","154.708","48.46","161.509","50.59"
"Psychiatrists","0.01","376.25","0","0","157.023","41.734","219.227","58.266"
"News Analysts, Reporters, and Journalists","0.007","256.48","25.818","10.066","130.985","51.07","99.677","38.863"
"Recreational Therapists","0.011","390.3","33.926","8.692","122.359","31.35","234.015","59.958"
"Medical Appliance Technicians","0.006","226","7.069","3.128","148.425","65.675","70.506","31.197"
"Forging Machine Setters, Operators, and Tenders, Metal and Plastic","0.006","230.59","150.298","65.18","4.489","1.947","75.804","32.874"
"Musicians and Singers","0.017","619.38","0","0","154.653","24.969","464.727","75.031"
"Shampooers","0.01","374.2","31.445","8.403","121.789","32.546","220.967","59.05"
"Metal-Refining Furnace Operators and Tenders","0.006","222.79","151.966","68.21","0.691","0.31","70.134","31.48"
"Metal Workers and Plastic Workers, All Other","0.006","213.85","129.188","60.41","23.174","10.836","61.489","28.753"
"Stationary Engineers and Boiler Operators","0.008","292.11","132.874","45.488","18.418","6.305","140.817","48.207"
"Motorcycle Mechanics","0.009","316.05","69.478","21.983","81.488","25.783","165.084","52.233"
"Sociology Teachers, Postsecondary","0.006","230.78","17.948","7.777","132.742","57.519","80.09","34.704"
"Precision Instrument and Equipment Repairers, All Other","0.007","250.32","121.361","48.482","26.609","10.63","102.35","40.888"
"Carpet Installers","0.007","254.89","30.691","12.041","114.933","45.091","109.266","42.868"
"Airfield Operations Specialists","0.008","288.44","104.72","36.306","38.097","13.208","145.622","50.486"
"Agents and Business Managers of Artists, Performers, and Athletes","0.007","235.11","43.636","18.56","98.823","42.033","92.651","39.408"
"Drafters, All Other","0.008","268.97","8.687","3.23","132.223","49.159","128.061","47.611"
"Dietetic Technicians","0.013","458.92","6.952","1.515","133.026","28.987","318.942","69.498"
"Compensation and Benefits Managers","0.009","311.41","9.271","2.977","128.982","41.419","173.157","55.604"
"Fiberglass Laminators and Fabricators","0.005","175.3","119.853","68.37","16.59","9.464","38.857","22.166"
"Computer and Information Research Scientists","0.012","416.22","0","0","135.206","32.484","281.014","67.516"
"Physical Scientists, All Other","0.006","221.9","64.988","29.287","66.373","29.911","90.539","40.802"
"Plant and System Operators, All Other","0.006","220.56","111.891","50.73","18.262","8.28","90.408","40.99"
"Media and Communication Workers, All Other","0.007","254.7","29.692","11.658","99.88","39.215","125.128","49.127"
"Mining and Geological Engineers, Including Mining Safety Engineers","0.01","353.31","53.914","15.26","74.44","21.069","224.956","63.671"
"Broadcast Announcers and Radio Disc Jockeys","0.007","240.94","21.392","8.879","106.309","44.123","113.239","46.999"
"Grounds Maintenance Workers, All Other","0.006","228.13","50.62","22.189","76.209","33.406","101.301","44.405"
"Counselors, All Other","0.008","269","26.086","9.697","98.68","36.684","144.234","53.618"
"Agricultural Sciences Teachers, Postsecondary","0.006","201.3","8.784","4.364","115.5","57.377","77.016","38.259"
"Economics Teachers, Postsecondary","0.006","211.11","12.638","5.987","110.851","52.509","87.62","41.505"
"Furnace, Kiln, Oven, Drier, and Kettle Operators and Tenders","0.005","175.08","109.276","62.415","12.784","7.302","53.02","30.283"
"Agricultural Equipment Operators","0.005","192.13","99.343","51.706","22.335","11.625","70.452","36.669"
"Painting, Coating, and Decorating Workers","0.005","162.86","110.608","67.916","10.96","6.73","41.292","25.354"
"Atmospheric, Earth, Marine, and Space Sciences Teachers, Postsecondary","0.006","201.3","18.629","9.254","102.333","50.836","80.338","39.909"
"Nuclear Medicine Technologists","0.009","311.24","73.251","23.535","47.35","15.213","190.639","61.251"
"Actuaries","0.004","152.07","41.256","27.13","78.482","51.609","32.332","21.261"
"Musical Instrument Repairers and Tuners","0.005","184.31","83.266","45.177","35.71","19.375","65.334","35.448"
"Textile Cutting Machine Setters, Operators, and Tenders","0.004","159.14","114.657","72.048","3.729","2.343","40.754","25.609"
"Photographic Process Workers and Processing Machine Operators","0.004","158.9","97.615","61.432","20.108","12.654","41.178","25.914"
"Electronic Equipment Installers and Repairers, Motor Vehicles","0.005","185.73","103.363","55.652","13.638","7.343","68.729","37.005"
"First-Line Supervisors of Police and Detectives","0.007","256.36","48.732","19.009","63.99","24.961","143.638","56.03"
"Door-to-Door Sales Workers, News and Street Vendors, and Related Workers","0.004","157.72","54.45","34.523","52.146","33.062","51.124","32.414"
"Pile Driver Operators","0.006","207.5","67.237","32.403","37.842","18.237","102.421","49.359"
"Bioengineers and Biomedical Engineers","0.006","218.15","16.473","7.551","86.785","39.782","114.892","52.666"
"Wind Turbine Service Technicians","0.011","411.24","4.588","1.116","95.744","23.282","310.908","75.602"
"Architecture Teachers, Postsecondary","0.004","142.39","8.588","6.031","91.264","64.095","42.538","29.874"
"Camera Operators, Television, Video, and Film","0.006","222.18","13.541","6.095","84.745","38.142","123.894","55.763"
"Atmospheric and Space Scientists","0.004","155.38","61.232","39.408","36.893","23.744","57.255","36.848"
"Adhesive Bonding Machine Operators and Tenders","0.004","127.32","90.854","71.359","6.814","5.352","29.652","23.289"
"Physicists","0.005","187.14","27.836","14.874","67.892","36.279","91.412","48.847"
"Biological Scientists, All Other","0.007","251.86","31.879","12.657","62.703","24.896","157.278","62.447"
"Electric Motor, Power Tool, and Related Repairers","0.006","201.49","81.812","40.603","11.342","5.629","108.336","53.767"
"Economists","0.006","209.45","2.508","1.198","89.509","42.735","117.432","56.067"
"Foundry Mold and Coremakers","0.003","108.23","91.574","84.61","0","0","16.656","15.39"
"Social Workers, All Other","0.005","185.52","20.097","10.833","71.393","38.483","94.031","50.685"
"Social Work Teachers, Postsecondary","0.004","139.93","4.598","3.286","86.333","61.697","48.999","35.017"
"Woodworkers, All Other","0.003","119.7","83.966","70.147","6.039","5.045","29.695","24.808"
"Tank Car, Truck, and Ship Loaders","0.004","136.34","83.144","60.983","5.839","4.283","47.357","34.734"
"Special Education Teachers, All Other","0.01","355.96","1.334","0.375","87.401","24.554","267.225","75.072"
"Marine Engineers and Naval Architects","0.005","179.3","32.759","18.271","55.189","30.78","91.351","50.949"
"Locker Room, Coatroom, and Dressing Room Attendants","0.004","138.84","20.589","14.829","66.32","47.767","51.931","37.403"
"Motion Picture Projectionists","0.004","145.09","62.737","43.24","22.087","15.223","60.267","41.537"
"Animal Trainers","0.007","245.61","9.331","3.799","73.407","29.888","162.871","66.313"
"Survey Researchers","0.004","157.06","37.511","23.883","44.607","28.401","74.941","47.715"
"Area, Ethnic, and Cultural Studies Teachers, Postsecondary","0.004","137.48","9.332","6.788","72.607","52.812","55.542","40.4"
"Umpires, Referees, and Other Sports Officials","0.005","166.59","45.428","27.27","30.571","18.351","90.591","54.38"
"Acupuncturists and Healthcare Diagnosing or Treating Practitioners, All Other","0.006","213.59","13.896","6.506","61.266","28.684","138.428","64.81"
"Ambulance Drivers and Attendants, Except Emergency Medical Technicians","0.004","137.32","47.987","34.946","26.91","19.596","62.423","45.458"
"Private Detectives and Investigators","0.003","109.21","34.274","31.384","39.464","36.136","35.472","32.48"
"Forensic Science Technicians","0.003","103.56","60.061","57.996","13.107","12.657","30.392","29.347"
"Craft Artists","0.004","129.3","14.903","11.526","58.08","44.919","56.317","43.555"
"Pesticide Handlers, Sprayers, and Applicators, Vegetation","0.004","131.21","33.581","25.594","38.963","29.695","58.666","44.711"
"Funeral Home Managers","0.006","206.11","15.029","7.292","57.151","27.728","133.93","64.98"
"Pourers and Casters, Metal","0.003","92.32","65.355","70.792","6.748","7.309","20.217","21.899"
"Exercise Physiologists","0.004","159.14","1.074","0.675","70.805","44.492","87.261","54.833"
"Railroad Brake, Signal, and Switch Operators and Locomotive Firers","0.003","111.35","63.797","57.295","7.383","6.63","40.17","36.075"
"Commercial Divers","0.003","105","44.143","42.041","26.842","25.564","34.015","32.396"
"Food Scientists and Technologists","0.005","187.4","0","0","70.553","37.648","116.847","62.352"
"Desktop Publishers","0.003","93.32","43.273","46.371","26.822","28.742","23.224","24.887"
"Embalmers","0.006","227.59","15.543","6.829","54.456","23.927","157.591","69.243"
"Film and Video Editors","0.005","168.97","7.792","4.611","62.005","36.696","99.173","58.693"
"Continuous Mining Machine Operators","0.004","129.44","56.423","43.59","13.078","10.103","59.939","46.306"
"Music Directors and Composers","0.007","237.98","0","0","69.301","29.121","168.679","70.879"
"Marriage and Family Therapists","0.004","143.53","11.854","8.259","57.311","39.929","74.365","51.812"
"Cooling and Freezing Equipment Operators and Tenders","0.003","95.48","65.716","68.827","3.4","3.561","26.364","27.612"
"Choreographers","0.004","154.63","0","0","68.504","44.302","86.126","55.698"
"Audiologists","0.004","157.23","18.601","11.831","49.182","31.28","89.447","56.889"
"Orthotists and Prosthetists","0.004","133.53","24.029","17.995","40.649","30.442","68.853","51.563"
"Athletes and Sports Competitors","0.004","152.84","0","0","64.522","42.215","88.318","57.785"
"Textile, Apparel, and Furnishings Workers, All Other","0.003","101.84","36.265","35.609","26.493","26.015","39.082","38.376"
"Fine Artists, Including Painters, Sculptors, and Illustrators","0.004","128.06","3.64","2.843","58.82","45.931","65.6","51.226"
"Special Education Teachers, Preschool","0.006","204.51","0","0","60.915","29.786","143.595","70.214"
"Tool Grinders, Filers, and Sharpeners","0.002","79.56","56.532","71.055","3.888","4.887","19.14","24.057"
"Cutters and Trimmers, Hand","0.002","70.72","58.907","83.297","1.128","1.594","10.685","15.109"
"Urban and Regional Planners","0.004","135.16","0","0","59.818","44.257","75.342","55.743"
"Museum Technicians and Conservators","0.003","117.6","27.575","23.448","31.047","26.4","58.979","50.152"
"Layout Workers, Metal and Plastic","0.003","92.29","47.08","51.013","11.498","12.459","33.712","36.528"
"Materials Scientists","0.004","132.45","0","0","58.196","43.938","74.254","56.062"
"Actors","0.006","230.84","0","0","57.75","25.017","173.09","74.983"
"Orthodontists","0.005","165.37","9.517","5.755","48.12","29.098","107.733","65.146"
"Microbiologists","0.006","202.16","0","0","55.523","27.465","146.637","72.535"
"Statistical Assistants","0.002","63.28","34.348","54.28","20.35","32.159","8.581","13.561"
"Anthropology and Archeology Teachers, Postsecondary","0.002","83.48","5.042","6.04","49.574","59.384","28.864","34.576"
"Curators","0.005","163.67","0","0","53.986","32.984","109.684","67.016"
"Environmental Science Teachers, Postsecondary","0.002","83.48","6.606","7.913","45.37","54.348","31.504","37.739"
"Library Science Teachers, Postsecondary","0.002","76.09","5.334","7.01","46.507","61.121","24.249","31.869"
"First-Line Supervisors of Gambling Services Workers","0.002","83.46","21.46","25.713","28.209","33.8","33.79","40.487"
"First-Line Supervisors of Correctional Officers","0.003","103.46","16.862","16.298","32.199","31.123","54.399","52.58"
"Rock Splitters, Quarry","0.002","62.33","48.966","78.56","0","0","13.364","21.44"
"Correspondence Clerks","0.002","54.32","35.717","65.754","12.454","22.926","6.149","11.32"
"Anthropologists and Archeologists","0.002","82.42","0","0","47.203","57.271","35.217","42.729"
"Zoologists and Wildlife Biologists","0.003","92.36","1.623","1.757","43.884","47.514","46.853","50.728"
"Entertainment Attendants and Related Workers, All Other","0.002","70.97","40.95","57.701","4.341","6.116","25.679","36.183"
"Emergency Management Directors","0.002","84.29","2.725","3.233","42.361","50.257","39.203","46.51"
"Cooks, All Other","0.004","141.1","16.349","11.587","27.774","19.684","96.977","68.729"
"Extruding and Forming Machine Setters, Operators, and Tenders, Synthetic and Glass Fibers","0.002","54.12","42.986","79.427","0","0","11.134","20.573"
"Motorboat Operators","0.002","63.11","39.784","63.039","1.798","2.849","21.528","34.112"
"Probation Officers and Correctional Treatment Specialists","0.002","86.42","0","0","40.863","47.285","45.557","52.715"
"Podiatrists","0.004","127.92","5.058","3.954","35.549","27.79","87.313","68.256"
"Telephone Operators","0.001","50.34","37.842","75.172","2.562","5.09","9.936","19.738"
"First-Line Supervisors of Firefighting and Prevention Workers","0.002","71.12","11.854","16.668","28.174","39.614","31.092","43.718"
"Sound Engineering Technicians","0.003","101.4","16.166","15.943","23.188","22.867","62.046","61.19"
"Miscellaneous Entertainers and Performers, Sports and Related Workers","0.002","58.14","0","0","37.003","63.644","21.137","36.356"
"Gambling Change Persons and Booth Cashiers","0.001","45.09","36.547","81.053","0","0","8.543","18.947"
"Textile Knitting and Weaving Machine Setters, Operators, and Tenders","0.001","50.92","31.187","61.248","4.129","8.109","15.604","30.643"
"Geography Teachers, Postsecondary","0.002","54.01","4.563","8.449","30.721","56.881","18.725","34.67"
"Patternmakers, Metal and Plastic","0.001","44.33","26.104","58.886","8.544","19.275","9.681","21.839"
"Epidemiologists","0.004","136.76","0","0","34.103","24.936","102.657","75.064"
"Manufactured Building and Mobile Home Installers","0.001","50.99","18.644","36.563","15.33","30.065","17.016","33.372"
"Passenger Attendants","0.002","55.66","33.862","60.838","0","0","21.798","39.162"
"Aircraft Cargo Handling Supervisors","0.002","63.11","22.15","35.098","10.685","16.93","30.275","47.972"
"Directors, Religious Activities and Education","0.002","64.7","2.263","3.498","30.342","46.896","32.095","49.606"
"Electrical and Electronics Installers and Repairers, Transportation Equipment","0.002","66.25","6.559","9.901","25.558","38.578","34.133","51.522"
"Model Makers, Metal and Plastic","0.001","44.34","24.488","55.228","7.303","16.471","12.549","28.301"
"Lighting Technicians and Media and Communication Equipment Workers, All Other","0.002","62.5","13.224","21.158","18.268","29.229","31.008","49.613"
"Parking Enforcement Workers","0.001","46.78","29.853","63.816","1.461","3.123","15.466","33.061"
"Set and Exhibit Designers","0.002","67.31","4.249","6.313","26.828","39.858","36.233","53.83"
"Fashion Designers","0.002","67.49","0","0","29.726","44.045","37.764","55.955"
"Occupational Therapy Aides","0.002","77.29","1.201","1.555","27.507","35.589","48.582","62.856"
"Therapists, All Other","0.002","65.99","9.207","13.952","19.012","28.81","37.772","57.238"
"Soil and Plant Scientists","0.003","92.08","0","0","27.718","30.102","64.362","69.898"
"Floor Layers, Except Carpet, Wood, and Hard Tiles","0.001","44.45","5.93","13.34","20.854","46.916","17.666","39.744"
"Logging Equipment Operators","0.001","30.94","13.202","42.67","9.88","31.932","7.858","25.399"
"Religious Workers, All Other","0.001","49.32","0","0","22.681","45.988","26.639","54.012"
"Family and Consumer Sciences Teachers, Postsecondary","0.001","34.37","3.016","8.775","18.223","53.021","13.13","38.203"
"First-Line Supervisors of Farming, Fishing, and Forestry Workers","0.002","63.54","14.766","23.239","5.741","9.035","43.033","67.726"
"Judicial Law Clerks","0.001","26.87","11.336","42.189","8.013","29.821","7.521","27.991"
"Costume Attendants","0.001","46.92","10.625","22.645","8.233","17.546","28.062","59.809"
"Social Scientists and Related Workers, All Other","0.001","29.47","7.455","25.298","11.263","38.218","10.752","36.484"
"Farmers, Ranchers, and Other Agricultural Managers","0.001","45.34","6.074","13.396","12.526","27.628","26.74","58.976"
"Genetic Counselors","0.001","36.97","2.584","6.989","15.848","42.868","18.538","50.143"
"Mathematicians","0.001","29.47","4.76","16.152","13.397","45.459","11.313","38.389"
"Oral and Maxillofacial Surgeons","0.001","46.8","1.143","2.443","15.404","32.915","30.252","64.642"
"Ship Engineers","0.001","29.69","10.867","36.603","4.537","15.282","14.285","48.115"
